No.     Time           Source                Destination           Protocol Length Info
      1 0.000000000    192.168.75.132        192.168.75.254        DHCP     342    DHCP Request  - Transaction ID 0xe0bb7b49

Frame 1: 342 bytes on wire (2736 bits), 342 bytes captured (2736 bits) on interface 0
Ethernet II, Src: Vmware_61:6e:0f (00:0c:29:61:6e:0f), Dst: Vmware_e5:fc:22 (00:50:56:e5:fc:22)
Internet Protocol Version 4, Src: 192.168.75.132, Dst: 192.168.75.254
User Datagram Protocol, Src Port: 68, Dst Port: 67
Bootstrap Protocol (Request)

No.     Time           Source                Destination           Protocol Length Info
      2 0.003671575    192.168.75.254        192.168.75.132        DHCP     342    DHCP ACK      - Transaction ID 0xe0bb7b49

Frame 2: 342 bytes on wire (2736 bits), 342 bytes captured (2736 bits) on interface 0
Ethernet II, Src: Vmware_e5:fc:22 (00:50:56:e5:fc:22), Dst: Vmware_61:6e:0f (00:0c:29:61:6e:0f)
Internet Protocol Version 4, Src: 192.168.75.254, Dst: 192.168.75.132
User Datagram Protocol, Src Port: 67, Dst Port: 68
Bootstrap Protocol (ACK)

No.     Time           Source                Destination           Protocol Length Info
      3 5.254116367    Vmware_61:6e:0f       Vmware_e5:fc:22       ARP      42     Who has 192.168.75.254? Tell 192.168.75.132

Frame 3: 42 bytes on wire (336 bits), 42 bytes captured (336 bits) on interface 0
Ethernet II, Src: Vmware_61:6e:0f (00:0c:29:61:6e:0f), Dst: Vmware_e5:fc:22 (00:50:56:e5:fc:22)
Address Resolution Protocol (request)

No.     Time           Source                Destination           Protocol Length Info
      4 5.254474651    Vmware_e5:fc:22       Vmware_61:6e:0f       ARP      60     192.168.75.254 is at 00:50:56:e5:fc:22

Frame 4: 60 bytes on wire (480 bits), 60 bytes captured (480 bits) on interface 0
Ethernet II, Src: Vmware_e5:fc:22 (00:50:56:e5:fc:22), Dst: Vmware_61:6e:0f (00:0c:29:61:6e:0f)
Address Resolution Protocol (reply)

No.     Time           Source                Destination           Protocol Length Info
      5 10.449607279   192.168.75.132        121.36.6.255          TCP      74     39776 → 21 [SYN] Seq=0 Win=64240 Len=0 MSS=1460 SACK_PERM=1 TSval=3809752780 TSecr=0 WS=128

Frame 5: 74 bytes on wire (592 bits), 74 bytes captured (592 bits) on interface 0
Ethernet II, Src: Vmware_61:6e:0f (00:0c:29:61:6e:0f), Dst: Vmware_e1:04:02 (00:50:56:e1:04:02)
Internet Protocol Version 4, Src: 192.168.75.132, Dst: 121.36.6.255
Transmission Control Protocol, Src Port: 39776, Dst Port: 21, Seq: 0, Len: 0
    Source Port: 39776
    Destination Port: 21
    [Stream index: 0]
    [TCP Segment Len: 0]
    Sequence number: 0    (relative sequence number)
    [Next sequence number: 0    (relative sequence number)]
    Acknowledgment number: 0
    1010 .... = Header Length: 40 bytes (10)
    Flags: 0x002 (SYN)
    Window size value: 64240
    [Calculated window size: 64240]
    Checksum: 0x8c7e [unverified]
    [Checksum Status: Unverified]
    Urgent pointer: 0
    Options: (20 bytes), Maximum segment size, SACK permitted, Timestamps, No-Operation (NOP), Window scale
    [Timestamps]

No.     Time           Source                Destination           Protocol Length Info
      6 10.459116619   121.36.6.255          192.168.75.132        TCP      60     21 → 39776 [SYN, ACK] Seq=0 Ack=1 Win=64240 Len=0 MSS=1460

Frame 6: 60 bytes on wire (480 bits), 60 bytes captured (480 bits) on interface 0
Ethernet II, Src: Vmware_e1:04:02 (00:50:56:e1:04:02), Dst: Vmware_61:6e:0f (00:0c:29:61:6e:0f)
Internet Protocol Version 4, Src: 121.36.6.255, Dst: 192.168.75.132
Transmission Control Protocol, Src Port: 21, Dst Port: 39776, Seq: 0, Ack: 1, Len: 0
    Source Port: 21
    Destination Port: 39776
    [Stream index: 0]
    [TCP Segment Len: 0]
    Sequence number: 0    (relative sequence number)
    [Next sequence number: 0    (relative sequence number)]
    Acknowledgment number: 1    (relative ack number)
    0110 .... = Header Length: 24 bytes (6)
    Flags: 0x012 (SYN, ACK)
    Window size value: 64240
    [Calculated window size: 64240]
    Checksum: 0x2999 [unverified]
    [Checksum Status: Unverified]
    Urgent pointer: 0
    Options: (4 bytes), Maximum segment size
    [SEQ/ACK analysis]
    [Timestamps]

No.     Time           Source                Destination           Protocol Length Info
      7 10.459175481   192.168.75.132        121.36.6.255          TCP      54     39776 → 21 [ACK] Seq=1 Ack=1 Win=64240 Len=0

Frame 7: 54 bytes on wire (432 bits), 54 bytes captured (432 bits) on interface 0
Ethernet II, Src: Vmware_61:6e:0f (00:0c:29:61:6e:0f), Dst: Vmware_e1:04:02 (00:50:56:e1:04:02)
Internet Protocol Version 4, Src: 192.168.75.132, Dst: 121.36.6.255
Transmission Control Protocol, Src Port: 39776, Dst Port: 21, Seq: 1, Ack: 1, Len: 0
    Source Port: 39776
    Destination Port: 21
    [Stream index: 0]
    [TCP Segment Len: 0]
    Sequence number: 1    (relative sequence number)
    [Next sequence number: 1    (relative sequence number)]
    Acknowledgment number: 1    (relative ack number)
    0101 .... = Header Length: 20 bytes (5)
    Flags: 0x010 (ACK)
    Window size value: 64240
    [Calculated window size: 64240]
    [Window size scaling factor: -2 (no window scaling used)]
    Checksum: 0x8c6a [unverified]
    [Checksum Status: Unverified]
    Urgent pointer: 0
    [SEQ/ACK analysis]
    [Timestamps]

No.     Time           Source                Destination           Protocol Length Info
      8 10.467491049   121.36.6.255          192.168.75.132        FTP      74     Response: 220 (vsFTPd 3.0.3)

Frame 8: 74 bytes on wire (592 bits), 74 bytes captured (592 bits) on interface 0
Ethernet II, Src: Vmware_e1:04:02 (00:50:56:e1:04:02), Dst: Vmware_61:6e:0f (00:0c:29:61:6e:0f)
Internet Protocol Version 4, Src: 121.36.6.255, Dst: 192.168.75.132
Transmission Control Protocol, Src Port: 21, Dst Port: 39776, Seq: 1, Ack: 1, Len: 20
    Source Port: 21
    Destination Port: 39776
    [Stream index: 0]
    [TCP Segment Len: 20]
    Sequence number: 1    (relative sequence number)
    [Next sequence number: 21    (relative sequence number)]
    Acknowledgment number: 1    (relative ack number)
    0101 .... = Header Length: 20 bytes (5)
    Flags: 0x018 (PSH, ACK)
    Window size value: 64240
    [Calculated window size: 64240]
    [Window size scaling factor: -2 (no window scaling used)]
    Checksum: 0xe72a [unverified]
    [Checksum Status: Unverified]
    Urgent pointer: 0
    [SEQ/ACK analysis]
    [Timestamps]
    TCP payload (20 bytes)
File Transfer Protocol (FTP)
[Current working directory: ]

No.     Time           Source                Destination           Protocol Length Info
      9 10.467513486   192.168.75.132        121.36.6.255          TCP      54     39776 → 21 [ACK] Seq=1 Ack=21 Win=64220 Len=0

Frame 9: 54 bytes on wire (432 bits), 54 bytes captured (432 bits) on interface 0
Ethernet II, Src: Vmware_61:6e:0f (00:0c:29:61:6e:0f), Dst: Vmware_e1:04:02 (00:50:56:e1:04:02)
Internet Protocol Version 4, Src: 192.168.75.132, Dst: 121.36.6.255
Transmission Control Protocol, Src Port: 39776, Dst Port: 21, Seq: 1, Ack: 21, Len: 0
    Source Port: 39776
    Destination Port: 21
    [Stream index: 0]
    [TCP Segment Len: 0]
    Sequence number: 1    (relative sequence number)
    [Next sequence number: 1    (relative sequence number)]
    Acknowledgment number: 21    (relative ack number)
    0101 .... = Header Length: 20 bytes (5)
    Flags: 0x010 (ACK)
    Window size value: 64220
    [Calculated window size: 64220]
    [Window size scaling factor: -2 (no window scaling used)]
    Checksum: 0x8c6a [unverified]
    [Checksum Status: Unverified]
    Urgent pointer: 0
    [SEQ/ACK analysis]
    [Timestamps]

No.     Time           Source                Destination           Protocol Length Info
     10 10.467695394   192.168.75.132        121.36.6.255          FTP      65     Request: USER test

Frame 10: 65 bytes on wire (520 bits), 65 bytes captured (520 bits) on interface 0
Ethernet II, Src: Vmware_61:6e:0f (00:0c:29:61:6e:0f), Dst: Vmware_e1:04:02 (00:50:56:e1:04:02)
Internet Protocol Version 4, Src: 192.168.75.132, Dst: 121.36.6.255
Transmission Control Protocol, Src Port: 39776, Dst Port: 21, Seq: 1, Ack: 21, Len: 11
    Source Port: 39776
    Destination Port: 21
    [Stream index: 0]
    [TCP Segment Len: 11]
    Sequence number: 1    (relative sequence number)
    [Next sequence number: 12    (relative sequence number)]
    Acknowledgment number: 21    (relative ack number)
    0101 .... = Header Length: 20 bytes (5)
    Flags: 0x018 (PSH, ACK)
    Window size value: 64220
    [Calculated window size: 64220]
    [Window size scaling factor: -2 (no window scaling used)]
    Checksum: 0x8c75 [unverified]
    [Checksum Status: Unverified]
    Urgent pointer: 0
    [SEQ/ACK analysis]
    [Timestamps]
    TCP payload (11 bytes)
File Transfer Protocol (FTP)
[Current working directory: ]

No.     Time           Source                Destination           Protocol Length Info
     11 10.468038615   121.36.6.255          192.168.75.132        TCP      60     21 → 39776 [ACK] Seq=21 Ack=12 Win=64240 Len=0

Frame 11: 60 bytes on wire (480 bits), 60 bytes captured (480 bits) on interface 0
Ethernet II, Src: Vmware_e1:04:02 (00:50:56:e1:04:02), Dst: Vmware_61:6e:0f (00:0c:29:61:6e:0f)
Internet Protocol Version 4, Src: 121.36.6.255, Dst: 192.168.75.132
Transmission Control Protocol, Src Port: 21, Dst Port: 39776, Seq: 21, Ack: 12, Len: 0
    Source Port: 21
    Destination Port: 39776
    [Stream index: 0]
    [TCP Segment Len: 0]
    Sequence number: 21    (relative sequence number)
    [Next sequence number: 21    (relative sequence number)]
    Acknowledgment number: 12    (relative ack number)
    0101 .... = Header Length: 20 bytes (5)
    Flags: 0x010 (ACK)
    Window size value: 64240
    [Calculated window size: 64240]
    [Window size scaling factor: -2 (no window scaling used)]
    Checksum: 0x4137 [unverified]
    [Checksum Status: Unverified]
    Urgent pointer: 0
    [SEQ/ACK analysis]
    [Timestamps]

No.     Time           Source                Destination           Protocol Length Info
     12 10.476153595   121.36.6.255          192.168.75.132        FTP      88     Response: 331 Please specify the password.

Frame 12: 88 bytes on wire (704 bits), 88 bytes captured (704 bits) on interface 0
Ethernet II, Src: Vmware_e1:04:02 (00:50:56:e1:04:02), Dst: Vmware_61:6e:0f (00:0c:29:61:6e:0f)
Internet Protocol Version 4, Src: 121.36.6.255, Dst: 192.168.75.132
Transmission Control Protocol, Src Port: 21, Dst Port: 39776, Seq: 21, Ack: 12, Len: 34
    Source Port: 21
    Destination Port: 39776
    [Stream index: 0]
    [TCP Segment Len: 34]
    Sequence number: 21    (relative sequence number)
    [Next sequence number: 55    (relative sequence number)]
    Acknowledgment number: 12    (relative ack number)
    0101 .... = Header Length: 20 bytes (5)
    Flags: 0x018 (PSH, ACK)
    Window size value: 64240
    [Calculated window size: 64240]
    [Window size scaling factor: -2 (no window scaling used)]
    Checksum: 0xf9eb [unverified]
    [Checksum Status: Unverified]
    Urgent pointer: 0
    [SEQ/ACK analysis]
    [Timestamps]
    TCP payload (34 bytes)
File Transfer Protocol (FTP)
[Current working directory: ]

No.     Time           Source                Destination           Protocol Length Info
     13 10.476180751   192.168.75.132        121.36.6.255          TCP      54     39776 → 21 [ACK] Seq=12 Ack=55 Win=64186 Len=0

Frame 13: 54 bytes on wire (432 bits), 54 bytes captured (432 bits) on interface 0
Ethernet II, Src: Vmware_61:6e:0f (00:0c:29:61:6e:0f), Dst: Vmware_e1:04:02 (00:50:56:e1:04:02)
Internet Protocol Version 4, Src: 192.168.75.132, Dst: 121.36.6.255
Transmission Control Protocol, Src Port: 39776, Dst Port: 21, Seq: 12, Ack: 55, Len: 0
    Source Port: 39776
    Destination Port: 21
    [Stream index: 0]
    [TCP Segment Len: 0]
    Sequence number: 12    (relative sequence number)
    [Next sequence number: 12    (relative sequence number)]
    Acknowledgment number: 55    (relative ack number)
    0101 .... = Header Length: 20 bytes (5)
    Flags: 0x010 (ACK)
    Window size value: 64186
    [Calculated window size: 64186]
    [Window size scaling factor: -2 (no window scaling used)]
    Checksum: 0x8c6a [unverified]
    [Checksum Status: Unverified]
    Urgent pointer: 0
    [SEQ/ACK analysis]
    [Timestamps]

No.     Time           Source                Destination           Protocol Length Info
     14 10.476345862   192.168.75.132        121.36.6.255          FTP      65     Request: PASS test

Frame 14: 65 bytes on wire (520 bits), 65 bytes captured (520 bits) on interface 0
Ethernet II, Src: Vmware_61:6e:0f (00:0c:29:61:6e:0f), Dst: Vmware_e1:04:02 (00:50:56:e1:04:02)
Internet Protocol Version 4, Src: 192.168.75.132, Dst: 121.36.6.255
Transmission Control Protocol, Src Port: 39776, Dst Port: 21, Seq: 12, Ack: 55, Len: 11
    Source Port: 39776
    Destination Port: 21
    [Stream index: 0]
    [TCP Segment Len: 11]
    Sequence number: 12    (relative sequence number)
    [Next sequence number: 23    (relative sequence number)]
    Acknowledgment number: 55    (relative ack number)
    0101 .... = Header Length: 20 bytes (5)
    Flags: 0x018 (PSH, ACK)
    Window size value: 64186
    [Calculated window size: 64186]
    [Window size scaling factor: -2 (no window scaling used)]
    Checksum: 0x8c75 [unverified]
    [Checksum Status: Unverified]
    Urgent pointer: 0
    [SEQ/ACK analysis]
    [Timestamps]
    TCP payload (11 bytes)
File Transfer Protocol (FTP)
[Current working directory: ]

No.     Time           Source                Destination           Protocol Length Info
     15 10.476682214   121.36.6.255          192.168.75.132        TCP      60     21 → 39776 [ACK] Seq=55 Ack=23 Win=64240 Len=0

Frame 15: 60 bytes on wire (480 bits), 60 bytes captured (480 bits) on interface 0
Ethernet II, Src: Vmware_e1:04:02 (00:50:56:e1:04:02), Dst: Vmware_61:6e:0f (00:0c:29:61:6e:0f)
Internet Protocol Version 4, Src: 121.36.6.255, Dst: 192.168.75.132
Transmission Control Protocol, Src Port: 21, Dst Port: 39776, Seq: 55, Ack: 23, Len: 0
    Source Port: 21
    Destination Port: 39776
    [Stream index: 0]
    [TCP Segment Len: 0]
    Sequence number: 55    (relative sequence number)
    [Next sequence number: 55    (relative sequence number)]
    Acknowledgment number: 23    (relative ack number)
    0101 .... = Header Length: 20 bytes (5)
    Flags: 0x010 (ACK)
    Window size value: 64240
    [Calculated window size: 64240]
    [Window size scaling factor: -2 (no window scaling used)]
    Checksum: 0x410a [unverified]
    [Checksum Status: Unverified]
    Urgent pointer: 0
    [SEQ/ACK analysis]
    [Timestamps]

No.     Time           Source                Destination           Protocol Length Info
     16 10.496607490   121.36.6.255          192.168.75.132        FTP      77     Response: 230 Login successful.

Frame 16: 77 bytes on wire (616 bits), 77 bytes captured (616 bits) on interface 0
Ethernet II, Src: Vmware_e1:04:02 (00:50:56:e1:04:02), Dst: Vmware_61:6e:0f (00:0c:29:61:6e:0f)
Internet Protocol Version 4, Src: 121.36.6.255, Dst: 192.168.75.132
Transmission Control Protocol, Src Port: 21, Dst Port: 39776, Seq: 55, Ack: 23, Len: 23
    Source Port: 21
    Destination Port: 39776
    [Stream index: 0]
    [TCP Segment Len: 23]
    Sequence number: 55    (relative sequence number)
    [Next sequence number: 78    (relative sequence number)]
    Acknowledgment number: 23    (relative ack number)
    0101 .... = Header Length: 20 bytes (5)
    Flags: 0x018 (PSH, ACK)
    Window size value: 64240
    [Calculated window size: 64240]
    [Window size scaling factor: -2 (no window scaling used)]
    Checksum: 0x5f72 [unverified]
    [Checksum Status: Unverified]
    Urgent pointer: 0
    [SEQ/ACK analysis]
    [Timestamps]
    TCP payload (23 bytes)
File Transfer Protocol (FTP)
[Current working directory: ]

No.     Time           Source                Destination           Protocol Length Info
     17 10.496644579   192.168.75.132        121.36.6.255          TCP      54     39776 → 21 [ACK] Seq=23 Ack=78 Win=64163 Len=0

Frame 17: 54 bytes on wire (432 bits), 54 bytes captured (432 bits) on interface 0
Ethernet II, Src: Vmware_61:6e:0f (00:0c:29:61:6e:0f), Dst: Vmware_e1:04:02 (00:50:56:e1:04:02)
Internet Protocol Version 4, Src: 192.168.75.132, Dst: 121.36.6.255
Transmission Control Protocol, Src Port: 39776, Dst Port: 21, Seq: 23, Ack: 78, Len: 0
    Source Port: 39776
    Destination Port: 21
    [Stream index: 0]
    [TCP Segment Len: 0]
    Sequence number: 23    (relative sequence number)
    [Next sequence number: 23    (relative sequence number)]
    Acknowledgment number: 78    (relative ack number)
    0101 .... = Header Length: 20 bytes (5)
    Flags: 0x010 (ACK)
    Window size value: 64163
    [Calculated window size: 64163]
    [Window size scaling factor: -2 (no window scaling used)]
    Checksum: 0x8c6a [unverified]
    [Checksum Status: Unverified]
    Urgent pointer: 0
    [SEQ/ACK analysis]
    [Timestamps]

No.     Time           Source                Destination           Protocol Length Info
     18 10.496925281   192.168.75.132        121.36.6.255          FTP      62     Request: TYPE I

Frame 18: 62 bytes on wire (496 bits), 62 bytes captured (496 bits) on interface 0
Ethernet II, Src: Vmware_61:6e:0f (00:0c:29:61:6e:0f), Dst: Vmware_e1:04:02 (00:50:56:e1:04:02)
Internet Protocol Version 4, Src: 192.168.75.132, Dst: 121.36.6.255
Transmission Control Protocol, Src Port: 39776, Dst Port: 21, Seq: 23, Ack: 78, Len: 8
    Source Port: 39776
    Destination Port: 21
    [Stream index: 0]
    [TCP Segment Len: 8]
    Sequence number: 23    (relative sequence number)
    [Next sequence number: 31    (relative sequence number)]
    Acknowledgment number: 78    (relative ack number)
    0101 .... = Header Length: 20 bytes (5)
    Flags: 0x018 (PSH, ACK)
    Window size value: 64163
    [Calculated window size: 64163]
    [Window size scaling factor: -2 (no window scaling used)]
    Checksum: 0x8c72 [unverified]
    [Checksum Status: Unverified]
    Urgent pointer: 0
    [SEQ/ACK analysis]
    [Timestamps]
    TCP payload (8 bytes)
File Transfer Protocol (FTP)
[Current working directory: ]

No.     Time           Source                Destination           Protocol Length Info
     19 10.497413403   121.36.6.255          192.168.75.132        TCP      60     21 → 39776 [ACK] Seq=78 Ack=31 Win=64240 Len=0

Frame 19: 60 bytes on wire (480 bits), 60 bytes captured (480 bits) on interface 0
Ethernet II, Src: Vmware_e1:04:02 (00:50:56:e1:04:02), Dst: Vmware_61:6e:0f (00:0c:29:61:6e:0f)
Internet Protocol Version 4, Src: 121.36.6.255, Dst: 192.168.75.132
Transmission Control Protocol, Src Port: 21, Dst Port: 39776, Seq: 78, Ack: 31, Len: 0
    Source Port: 21
    Destination Port: 39776
    [Stream index: 0]
    [TCP Segment Len: 0]
    Sequence number: 78    (relative sequence number)
    [Next sequence number: 78    (relative sequence number)]
    Acknowledgment number: 31    (relative ack number)
    0101 .... = Header Length: 20 bytes (5)
    Flags: 0x010 (ACK)
    Window size value: 64240
    [Calculated window size: 64240]
    [Window size scaling factor: -2 (no window scaling used)]
    Checksum: 0x40eb [unverified]
    [Checksum Status: Unverified]
    Urgent pointer: 0
    [SEQ/ACK analysis]
    [Timestamps]

No.     Time           Source                Destination           Protocol Length Info
     20 10.505177775   121.36.6.255          192.168.75.132        FTP      85     Response: 200 Switching to Binary mode.

Frame 20: 85 bytes on wire (680 bits), 85 bytes captured (680 bits) on interface 0
Ethernet II, Src: Vmware_e1:04:02 (00:50:56:e1:04:02), Dst: Vmware_61:6e:0f (00:0c:29:61:6e:0f)
Internet Protocol Version 4, Src: 121.36.6.255, Dst: 192.168.75.132
Transmission Control Protocol, Src Port: 21, Dst Port: 39776, Seq: 78, Ack: 31, Len: 31
    Source Port: 21
    Destination Port: 39776
    [Stream index: 0]
    [TCP Segment Len: 31]
    Sequence number: 78    (relative sequence number)
    [Next sequence number: 109    (relative sequence number)]
    Acknowledgment number: 31    (relative ack number)
    0101 .... = Header Length: 20 bytes (5)
    Flags: 0x018 (PSH, ACK)
    Window size value: 64240
    [Calculated window size: 64240]
    [Window size scaling factor: -2 (no window scaling used)]
    Checksum: 0x0afc [unverified]
    [Checksum Status: Unverified]
    Urgent pointer: 0
    [SEQ/ACK analysis]
    [Timestamps]
    TCP payload (31 bytes)
File Transfer Protocol (FTP)
[Current working directory: ]

No.     Time           Source                Destination           Protocol Length Info
     21 10.505292801   192.168.75.132        121.36.6.255          FTP      60     Request: PASV

Frame 21: 60 bytes on wire (480 bits), 60 bytes captured (480 bits) on interface 0
Ethernet II, Src: Vmware_61:6e:0f (00:0c:29:61:6e:0f), Dst: Vmware_e1:04:02 (00:50:56:e1:04:02)
Internet Protocol Version 4, Src: 192.168.75.132, Dst: 121.36.6.255
Transmission Control Protocol, Src Port: 39776, Dst Port: 21, Seq: 31, Ack: 109, Len: 6
    Source Port: 39776
    Destination Port: 21
    [Stream index: 0]
    [TCP Segment Len: 6]
    Sequence number: 31    (relative sequence number)
    [Next sequence number: 37    (relative sequence number)]
    Acknowledgment number: 109    (relative ack number)
    0101 .... = Header Length: 20 bytes (5)
    Flags: 0x018 (PSH, ACK)
    Window size value: 64132
    [Calculated window size: 64132]
    [Window size scaling factor: -2 (no window scaling used)]
    Checksum: 0x8c70 [unverified]
    [Checksum Status: Unverified]
    Urgent pointer: 0
    [SEQ/ACK analysis]
    [Timestamps]
    TCP payload (6 bytes)
File Transfer Protocol (FTP)
[Current working directory: ]

No.     Time           Source                Destination           Protocol Length Info
     22 10.505654765   121.36.6.255          192.168.75.132        TCP      60     21 → 39776 [ACK] Seq=109 Ack=37 Win=64240 Len=0

Frame 22: 60 bytes on wire (480 bits), 60 bytes captured (480 bits) on interface 0
Ethernet II, Src: Vmware_e1:04:02 (00:50:56:e1:04:02), Dst: Vmware_61:6e:0f (00:0c:29:61:6e:0f)
Internet Protocol Version 4, Src: 121.36.6.255, Dst: 192.168.75.132
Transmission Control Protocol, Src Port: 21, Dst Port: 39776, Seq: 109, Ack: 37, Len: 0
    Source Port: 21
    Destination Port: 39776
    [Stream index: 0]
    [TCP Segment Len: 0]
    Sequence number: 109    (relative sequence number)
    [Next sequence number: 109    (relative sequence number)]
    Acknowledgment number: 37    (relative ack number)
    0101 .... = Header Length: 20 bytes (5)
    Flags: 0x010 (ACK)
    Window size value: 64240
    [Calculated window size: 64240]
    [Window size scaling factor: -2 (no window scaling used)]
    Checksum: 0x40c6 [unverified]
    [Checksum Status: Unverified]
    Urgent pointer: 0
    [SEQ/ACK analysis]
    [Timestamps]

No.     Time           Source                Destination           Protocol Length Info
     23 10.513396856   121.36.6.255          192.168.75.132        FTP      101    Response: 227 Entering Passive Mode (121,36,6,255,14,3)

Frame 23: 101 bytes on wire (808 bits), 101 bytes captured (808 bits) on interface 0
Ethernet II, Src: Vmware_e1:04:02 (00:50:56:e1:04:02), Dst: Vmware_61:6e:0f (00:0c:29:61:6e:0f)
Internet Protocol Version 4, Src: 121.36.6.255, Dst: 192.168.75.132
Transmission Control Protocol, Src Port: 21, Dst Port: 39776, Seq: 109, Ack: 37, Len: 47
    Source Port: 21
    Destination Port: 39776
    [Stream index: 0]
    [TCP Segment Len: 47]
    Sequence number: 109    (relative sequence number)
    [Next sequence number: 156    (relative sequence number)]
    Acknowledgment number: 37    (relative ack number)
    0101 .... = Header Length: 20 bytes (5)
    Flags: 0x018 (PSH, ACK)
    Window size value: 64240
    [Calculated window size: 64240]
    [Window size scaling factor: -2 (no window scaling used)]
    Checksum: 0xf16f [unverified]
    [Checksum Status: Unverified]
    Urgent pointer: 0
    [SEQ/ACK analysis]
    [Timestamps]
    TCP payload (47 bytes)
File Transfer Protocol (FTP)
[Current working directory: ]
[Command: STOR test/file000.out]
[Command frame: 27]

No.     Time           Source                Destination           Protocol Length Info
     24 10.514711623   192.168.75.132        121.36.6.255          TCP      74     42034 → 3587 [SYN] Seq=0 Win=64240 Len=0 MSS=1460 SACK_PERM=1 TSval=3809752845 TSecr=0 WS=128

Frame 24: 74 bytes on wire (592 bits), 74 bytes captured (592 bits) on interface 0
Ethernet II, Src: Vmware_61:6e:0f (00:0c:29:61:6e:0f), Dst: Vmware_e1:04:02 (00:50:56:e1:04:02)
Internet Protocol Version 4, Src: 192.168.75.132, Dst: 121.36.6.255
Transmission Control Protocol, Src Port: 42034, Dst Port: 3587, Seq: 0, Len: 0
    Source Port: 42034
    Destination Port: 3587
    [Stream index: 1]
    [TCP Segment Len: 0]
    Sequence number: 0    (relative sequence number)
    [Next sequence number: 0    (relative sequence number)]
    Acknowledgment number: 0
    1010 .... = Header Length: 40 bytes (10)
    Flags: 0x002 (SYN)
    Window size value: 64240
    [Calculated window size: 64240]
    Checksum: 0x8c7e [unverified]
    [Checksum Status: Unverified]
    Urgent pointer: 0
    Options: (20 bytes), Maximum segment size, SACK permitted, Timestamps, No-Operation (NOP), Window scale
    [Timestamps]

No.     Time           Source                Destination           Protocol Length Info
     25 10.522779075   121.36.6.255          192.168.75.132        TCP      60     3587 → 42034 [SYN, ACK] Seq=0 Ack=1 Win=64240 Len=0 MSS=1460

Frame 25: 60 bytes on wire (480 bits), 60 bytes captured (480 bits) on interface 0
Ethernet II, Src: Vmware_e1:04:02 (00:50:56:e1:04:02), Dst: Vmware_61:6e:0f (00:0c:29:61:6e:0f)
Internet Protocol Version 4, Src: 121.36.6.255, Dst: 192.168.75.132
Transmission Control Protocol, Src Port: 3587, Dst Port: 42034, Seq: 0, Ack: 1, Len: 0
    Source Port: 3587
    Destination Port: 42034
    [Stream index: 1]
    [TCP Segment Len: 0]
    Sequence number: 0    (relative sequence number)
    [Next sequence number: 0    (relative sequence number)]
    Acknowledgment number: 1    (relative ack number)
    0110 .... = Header Length: 24 bytes (6)
    Flags: 0x012 (SYN, ACK)
    Window size value: 64240
    [Calculated window size: 64240]
    Checksum: 0x5c98 [unverified]
    [Checksum Status: Unverified]
    Urgent pointer: 0
    Options: (4 bytes), Maximum segment size
    [SEQ/ACK analysis]
    [Timestamps]

No.     Time           Source                Destination           Protocol Length Info
     26 10.522825514   192.168.75.132        121.36.6.255          TCP      54     42034 → 3587 [ACK] Seq=1 Ack=1 Win=64240 Len=0

Frame 26: 54 bytes on wire (432 bits), 54 bytes captured (432 bits) on interface 0
Ethernet II, Src: Vmware_61:6e:0f (00:0c:29:61:6e:0f), Dst: Vmware_e1:04:02 (00:50:56:e1:04:02)
Internet Protocol Version 4, Src: 192.168.75.132, Dst: 121.36.6.255
Transmission Control Protocol, Src Port: 42034, Dst Port: 3587, Seq: 1, Ack: 1, Len: 0
    Source Port: 42034
    Destination Port: 3587
    [Stream index: 1]
    [TCP Segment Len: 0]
    Sequence number: 1    (relative sequence number)
    [Next sequence number: 1    (relative sequence number)]
    Acknowledgment number: 1    (relative ack number)
    0101 .... = Header Length: 20 bytes (5)
    Flags: 0x010 (ACK)
    Window size value: 64240
    [Calculated window size: 64240]
    [Window size scaling factor: -2 (no window scaling used)]
    Checksum: 0x8c6a [unverified]
    [Checksum Status: Unverified]
    Urgent pointer: 0
    [SEQ/ACK analysis]
    [Timestamps]

No.     Time           Source                Destination           Protocol Length Info
     27 10.523056362   192.168.75.132        121.36.6.255          FTP      77     Request: STOR test/file000.out

Frame 27: 77 bytes on wire (616 bits), 77 bytes captured (616 bits) on interface 0
Ethernet II, Src: Vmware_61:6e:0f (00:0c:29:61:6e:0f), Dst: Vmware_e1:04:02 (00:50:56:e1:04:02)
Internet Protocol Version 4, Src: 192.168.75.132, Dst: 121.36.6.255
Transmission Control Protocol, Src Port: 39776, Dst Port: 21, Seq: 37, Ack: 156, Len: 23
    Source Port: 39776
    Destination Port: 21
    [Stream index: 0]
    [TCP Segment Len: 23]
    Sequence number: 37    (relative sequence number)
    [Next sequence number: 60    (relative sequence number)]
    Acknowledgment number: 156    (relative ack number)
    0101 .... = Header Length: 20 bytes (5)
    Flags: 0x018 (PSH, ACK)
    Window size value: 64085
    [Calculated window size: 64085]
    [Window size scaling factor: -2 (no window scaling used)]
    Checksum: 0x8c81 [unverified]
    [Checksum Status: Unverified]
    Urgent pointer: 0
    [SEQ/ACK analysis]
    [Timestamps]
    TCP payload (23 bytes)
File Transfer Protocol (FTP)
[Current working directory: ]
[Command response frames: 1]
[Command response bytes: 484]
[Command response first frame: 30]
[Command response last frame: 30]
[Setup frame: 23]

No.     Time           Source                Destination           Protocol Length Info
     28 10.523434148   121.36.6.255          192.168.75.132        TCP      60     21 → 39776 [ACK] Seq=156 Ack=60 Win=64240 Len=0

Frame 28: 60 bytes on wire (480 bits), 60 bytes captured (480 bits) on interface 0
Ethernet II, Src: Vmware_e1:04:02 (00:50:56:e1:04:02), Dst: Vmware_61:6e:0f (00:0c:29:61:6e:0f)
Internet Protocol Version 4, Src: 121.36.6.255, Dst: 192.168.75.132
Transmission Control Protocol, Src Port: 21, Dst Port: 39776, Seq: 156, Ack: 60, Len: 0
    Source Port: 21
    Destination Port: 39776
    [Stream index: 0]
    [TCP Segment Len: 0]
    Sequence number: 156    (relative sequence number)
    [Next sequence number: 156    (relative sequence number)]
    Acknowledgment number: 60    (relative ack number)
    0101 .... = Header Length: 20 bytes (5)
    Flags: 0x010 (ACK)
    Window size value: 64240
    [Calculated window size: 64240]
    [Window size scaling factor: -2 (no window scaling used)]
    Checksum: 0x4080 [unverified]
    [Checksum Status: Unverified]
    Urgent pointer: 0
    [SEQ/ACK analysis]
    [Timestamps]

No.     Time           Source                Destination           Protocol Length Info
     29 10.531696178   121.36.6.255          192.168.75.132        FTP      76     Response: 150 Ok to send data.

Frame 29: 76 bytes on wire (608 bits), 76 bytes captured (608 bits) on interface 0
Ethernet II, Src: Vmware_e1:04:02 (00:50:56:e1:04:02), Dst: Vmware_61:6e:0f (00:0c:29:61:6e:0f)
Internet Protocol Version 4, Src: 121.36.6.255, Dst: 192.168.75.132
Transmission Control Protocol, Src Port: 21, Dst Port: 39776, Seq: 156, Ack: 60, Len: 22
    Source Port: 21
    Destination Port: 39776
    [Stream index: 0]
    [TCP Segment Len: 22]
    Sequence number: 156    (relative sequence number)
    [Next sequence number: 178    (relative sequence number)]
    Acknowledgment number: 60    (relative ack number)
    0101 .... = Header Length: 20 bytes (5)
    Flags: 0x018 (PSH, ACK)
    Window size value: 64240
    [Calculated window size: 64240]
    [Window size scaling factor: -2 (no window scaling used)]
    Checksum: 0x2e32 [unverified]
    [Checksum Status: Unverified]
    Urgent pointer: 0
    [SEQ/ACK analysis]
    [Timestamps]
    TCP payload (22 bytes)
File Transfer Protocol (FTP)
[Current working directory: ]

No.     Time           Source                Destination           Protocol Length Info
     30 10.531788500   192.168.75.132        121.36.6.255          FTP-DATA 538    FTP Data: 484 bytes (PASV) (STOR test/file000.out)

Frame 30: 538 bytes on wire (4304 bits), 538 bytes captured (4304 bits) on interface 0
Ethernet II, Src: Vmware_61:6e:0f (00:0c:29:61:6e:0f), Dst: Vmware_e1:04:02 (00:50:56:e1:04:02)
Internet Protocol Version 4, Src: 192.168.75.132, Dst: 121.36.6.255
Transmission Control Protocol, Src Port: 42034, Dst Port: 3587, Seq: 1, Ack: 1, Len: 484
    Source Port: 42034
    Destination Port: 3587
    [Stream index: 1]
    [TCP Segment Len: 484]
    Sequence number: 1    (relative sequence number)
    [Next sequence number: 485    (relative sequence number)]
    Acknowledgment number: 1    (relative ack number)
    0101 .... = Header Length: 20 bytes (5)
    Flags: 0x018 (PSH, ACK)
    Window size value: 64240
    [Calculated window size: 64240]
    [Window size scaling factor: -2 (no window scaling used)]
    Checksum: 0x8e4e [unverified]
    [Checksum Status: Unverified]
    Urgent pointer: 0
    [SEQ/ACK analysis]
    [Timestamps]
    TCP payload (484 bytes)
FTP Data (484 bytes data)
[Setup frame: 23]
[Setup method: PASV]
[Command: STOR test/file000.out]
Command frame: 27
[Current working directory: ]
Line-based text data (1 lines)

No.     Time           Source                Destination           Protocol Length Info
     31 10.532038182   192.168.75.132        121.36.6.255          TCP      54     42034 → 3587 [FIN, ACK] Seq=485 Ack=1 Win=64240 Len=0

Frame 31: 54 bytes on wire (432 bits), 54 bytes captured (432 bits) on interface 0
Ethernet II, Src: Vmware_61:6e:0f (00:0c:29:61:6e:0f), Dst: Vmware_e1:04:02 (00:50:56:e1:04:02)
Internet Protocol Version 4, Src: 192.168.75.132, Dst: 121.36.6.255
Transmission Control Protocol, Src Port: 42034, Dst Port: 3587, Seq: 485, Ack: 1, Len: 0
    Source Port: 42034
    Destination Port: 3587
    [Stream index: 1]
    [TCP Segment Len: 0]
    Sequence number: 485    (relative sequence number)
    [Next sequence number: 485    (relative sequence number)]
    Acknowledgment number: 1    (relative ack number)
    0101 .... = Header Length: 20 bytes (5)
    Flags: 0x011 (FIN, ACK)
    Window size value: 64240
    [Calculated window size: 64240]
    [Window size scaling factor: -2 (no window scaling used)]
    Checksum: 0x8c6a [unverified]
    [Checksum Status: Unverified]
    Urgent pointer: 0
    [Timestamps]

No.     Time           Source                Destination           Protocol Length Info
     32 10.532251186   121.36.6.255          192.168.75.132        TCP      60     3587 → 42034 [ACK] Seq=1 Ack=485 Win=64240 Len=0

Frame 32: 60 bytes on wire (480 bits), 60 bytes captured (480 bits) on interface 0
Ethernet II, Src: Vmware_e1:04:02 (00:50:56:e1:04:02), Dst: Vmware_61:6e:0f (00:0c:29:61:6e:0f)
Internet Protocol Version 4, Src: 121.36.6.255, Dst: 192.168.75.132
Transmission Control Protocol, Src Port: 3587, Dst Port: 42034, Seq: 1, Ack: 485, Len: 0
    Source Port: 3587
    Destination Port: 42034
    [Stream index: 1]
    [TCP Segment Len: 0]
    Sequence number: 1    (relative sequence number)
    [Next sequence number: 1    (relative sequence number)]
    Acknowledgment number: 485    (relative ack number)
    0101 .... = Header Length: 20 bytes (5)
    Flags: 0x010 (ACK)
    Window size value: 64240
    [Calculated window size: 64240]
    [Window size scaling factor: -2 (no window scaling used)]
    Checksum: 0x7271 [unverified]
    [Checksum Status: Unverified]
    Urgent pointer: 0
    [SEQ/ACK analysis]
    [Timestamps]

No.     Time           Source                Destination           Protocol Length Info
     33 10.532508588   121.36.6.255          192.168.75.132        TCP      60     3587 → 42034 [ACK] Seq=1 Ack=486 Win=64239 Len=0

Frame 33: 60 bytes on wire (480 bits), 60 bytes captured (480 bits) on interface 0
Ethernet II, Src: Vmware_e1:04:02 (00:50:56:e1:04:02), Dst: Vmware_61:6e:0f (00:0c:29:61:6e:0f)
Internet Protocol Version 4, Src: 121.36.6.255, Dst: 192.168.75.132
Transmission Control Protocol, Src Port: 3587, Dst Port: 42034, Seq: 1, Ack: 486, Len: 0
    Source Port: 3587
    Destination Port: 42034
    [Stream index: 1]
    [TCP Segment Len: 0]
    Sequence number: 1    (relative sequence number)
    [Next sequence number: 1    (relative sequence number)]
    Acknowledgment number: 486    (relative ack number)
    0101 .... = Header Length: 20 bytes (5)
    Flags: 0x010 (ACK)
    Window size value: 64239
    [Calculated window size: 64239]
    [Window size scaling factor: -2 (no window scaling used)]
    Checksum: 0x7271 [unverified]
    [Checksum Status: Unverified]
    Urgent pointer: 0
    [SEQ/ACK analysis]
    [Timestamps]

No.     Time           Source                Destination           Protocol Length Info
     34 10.539239587   121.36.6.255          192.168.75.132        TCP      60     3587 → 42034 [FIN, PSH, ACK] Seq=1 Ack=486 Win=64239 Len=0

Frame 34: 60 bytes on wire (480 bits), 60 bytes captured (480 bits) on interface 0
Ethernet II, Src: Vmware_e1:04:02 (00:50:56:e1:04:02), Dst: Vmware_61:6e:0f (00:0c:29:61:6e:0f)
Internet Protocol Version 4, Src: 121.36.6.255, Dst: 192.168.75.132
Transmission Control Protocol, Src Port: 3587, Dst Port: 42034, Seq: 1, Ack: 486, Len: 0
    Source Port: 3587
    Destination Port: 42034
    [Stream index: 1]
    [TCP Segment Len: 0]
    Sequence number: 1    (relative sequence number)
    [Next sequence number: 1    (relative sequence number)]
    Acknowledgment number: 486    (relative ack number)
    0101 .... = Header Length: 20 bytes (5)
    Flags: 0x019 (FIN, PSH, ACK)
    Window size value: 64239
    [Calculated window size: 64239]
    [Window size scaling factor: -2 (no window scaling used)]
    Checksum: 0x7268 [unverified]
    [Checksum Status: Unverified]
    Urgent pointer: 0
    [Timestamps]

No.     Time           Source                Destination           Protocol Length Info
     35 10.539269516   192.168.75.132        121.36.6.255          TCP      54     42034 → 3587 [ACK] Seq=486 Ack=2 Win=64240 Len=0

Frame 35: 54 bytes on wire (432 bits), 54 bytes captured (432 bits) on interface 0
Ethernet II, Src: Vmware_61:6e:0f (00:0c:29:61:6e:0f), Dst: Vmware_e1:04:02 (00:50:56:e1:04:02)
Internet Protocol Version 4, Src: 192.168.75.132, Dst: 121.36.6.255
Transmission Control Protocol, Src Port: 42034, Dst Port: 3587, Seq: 486, Ack: 2, Len: 0
    Source Port: 42034
    Destination Port: 3587
    [Stream index: 1]
    [TCP Segment Len: 0]
    Sequence number: 486    (relative sequence number)
    [Next sequence number: 486    (relative sequence number)]
    Acknowledgment number: 2    (relative ack number)
    0101 .... = Header Length: 20 bytes (5)
    Flags: 0x010 (ACK)
    Window size value: 64240
    [Calculated window size: 64240]
    [Window size scaling factor: -2 (no window scaling used)]
    Checksum: 0x726f [unverified]
    [Checksum Status: Unverified]
    Urgent pointer: 0
    [SEQ/ACK analysis]
    [Timestamps]

No.     Time           Source                Destination           Protocol Length Info
     36 10.546562796   121.36.6.255          192.168.75.132        FTP      78     Response: 226 Transfer complete.

Frame 36: 78 bytes on wire (624 bits), 78 bytes captured (624 bits) on interface 0
Ethernet II, Src: Vmware_e1:04:02 (00:50:56:e1:04:02), Dst: Vmware_61:6e:0f (00:0c:29:61:6e:0f)
Internet Protocol Version 4, Src: 121.36.6.255, Dst: 192.168.75.132
Transmission Control Protocol, Src Port: 21, Dst Port: 39776, Seq: 178, Ack: 60, Len: 24
    Source Port: 21
    Destination Port: 39776
    [Stream index: 0]
    [TCP Segment Len: 24]
    Sequence number: 178    (relative sequence number)
    [Next sequence number: 202    (relative sequence number)]
    Acknowledgment number: 60    (relative ack number)
    0101 .... = Header Length: 20 bytes (5)
    Flags: 0x018 (PSH, ACK)
    Window size value: 64240
    [Calculated window size: 64240]
    [Window size scaling factor: -2 (no window scaling used)]
    Checksum: 0x7154 [unverified]
    [Checksum Status: Unverified]
    Urgent pointer: 0
    [SEQ/ACK analysis]
    [Timestamps]
    TCP payload (24 bytes)
File Transfer Protocol (FTP)
[Current working directory: ]

