No.     Time           Source                Destination           Protocol Length Info
      1 0.000000000    192.168.75.132        121.36.6.255          TCP      74     40304 → 21 [SYN] Seq=0 Win=64240 Len=0 MSS=1460 SACK_PERM=1 TSval=3821373690 TSecr=0 WS=128

Frame 1: 74 bytes on wire (592 bits), 74 bytes captured (592 bits) on interface 0
Ethernet II, Src: Vmware_61:6e:0f (00:0c:29:61:6e:0f), Dst: Vmware_e1:04:02 (00:50:56:e1:04:02)
Internet Protocol Version 4, Src: 192.168.75.132, Dst: 121.36.6.255
Transmission Control Protocol, Src Port: 40304, Dst Port: 21, Seq: 0, Len: 0

No.     Time           Source                Destination           Protocol Length Info
      2 0.010694076    121.36.6.255          192.168.75.132        TCP      60     21 → 40304 [SYN, ACK] Seq=0 Ack=1 Win=64240 Len=0 MSS=1460

Frame 2: 60 bytes on wire (480 bits), 60 bytes captured (480 bits) on interface 0
Ethernet II, Src: Vmware_e1:04:02 (00:50:56:e1:04:02), Dst: Vmware_61:6e:0f (00:0c:29:61:6e:0f)
Internet Protocol Version 4, Src: 121.36.6.255, Dst: 192.168.75.132
Transmission Control Protocol, Src Port: 21, Dst Port: 40304, Seq: 0, Ack: 1, Len: 0

No.     Time           Source                Destination           Protocol Length Info
      3 0.010785099    192.168.75.132        121.36.6.255          TCP      54     40304 → 21 [ACK] Seq=1 Ack=1 Win=64240 Len=0

Frame 3: 54 bytes on wire (432 bits), 54 bytes captured (432 bits) on interface 0
Ethernet II, Src: Vmware_61:6e:0f (00:0c:29:61:6e:0f), Dst: Vmware_e1:04:02 (00:50:56:e1:04:02)
Internet Protocol Version 4, Src: 192.168.75.132, Dst: 121.36.6.255
Transmission Control Protocol, Src Port: 40304, Dst Port: 21, Seq: 1, Ack: 1, Len: 0

No.     Time           Source                Destination           Protocol Length Info
      4 0.019137496    121.36.6.255          192.168.75.132        FTP      74     Response: 220 (vsFTPd 3.0.3)

Frame 4: 74 bytes on wire (592 bits), 74 bytes captured (592 bits) on interface 0
Ethernet II, Src: Vmware_e1:04:02 (00:50:56:e1:04:02), Dst: Vmware_61:6e:0f (00:0c:29:61:6e:0f)
Internet Protocol Version 4, Src: 121.36.6.255, Dst: 192.168.75.132
Transmission Control Protocol, Src Port: 21, Dst Port: 40304, Seq: 1, Ack: 1, Len: 20
File Transfer Protocol (FTP)
[Current working directory: ]

No.     Time           Source                Destination           Protocol Length Info
      5 0.019170635    192.168.75.132        121.36.6.255          TCP      54     40304 → 21 [ACK] Seq=1 Ack=21 Win=64220 Len=0

Frame 5: 54 bytes on wire (432 bits), 54 bytes captured (432 bits) on interface 0
Ethernet II, Src: Vmware_61:6e:0f (00:0c:29:61:6e:0f), Dst: Vmware_e1:04:02 (00:50:56:e1:04:02)
Internet Protocol Version 4, Src: 192.168.75.132, Dst: 121.36.6.255
Transmission Control Protocol, Src Port: 40304, Dst Port: 21, Seq: 1, Ack: 21, Len: 0

No.     Time           Source                Destination           Protocol Length Info
      6 0.019432568    192.168.75.132        121.36.6.255          FTP      65     Request: USER test

Frame 6: 65 bytes on wire (520 bits), 65 bytes captured (520 bits) on interface 0
Ethernet II, Src: Vmware_61:6e:0f (00:0c:29:61:6e:0f), Dst: Vmware_e1:04:02 (00:50:56:e1:04:02)
Internet Protocol Version 4, Src: 192.168.75.132, Dst: 121.36.6.255
Transmission Control Protocol, Src Port: 40304, Dst Port: 21, Seq: 1, Ack: 21, Len: 11
File Transfer Protocol (FTP)
[Current working directory: ]
[Command response frames: 1]
[Command response bytes: 237]
[Command response first frame: 86]
[Command response last frame: 86]
[Setup frame: 79]

No.     Time           Source                Destination           Protocol Length Info
      7 0.019893539    121.36.6.255          192.168.75.132        TCP      60     21 → 40304 [ACK] Seq=21 Ack=12 Win=64240 Len=0

Frame 7: 60 bytes on wire (480 bits), 60 bytes captured (480 bits) on interface 0
Ethernet II, Src: Vmware_e1:04:02 (00:50:56:e1:04:02), Dst: Vmware_61:6e:0f (00:0c:29:61:6e:0f)
Internet Protocol Version 4, Src: 121.36.6.255, Dst: 192.168.75.132
Transmission Control Protocol, Src Port: 21, Dst Port: 40304, Seq: 21, Ack: 12, Len: 0

No.     Time           Source                Destination           Protocol Length Info
      8 0.028272489    121.36.6.255          192.168.75.132        FTP      88     Response: 331 Please specify the password.

Frame 8: 88 bytes on wire (704 bits), 88 bytes captured (704 bits) on interface 0
Ethernet II, Src: Vmware_e1:04:02 (00:50:56:e1:04:02), Dst: Vmware_61:6e:0f (00:0c:29:61:6e:0f)
Internet Protocol Version 4, Src: 121.36.6.255, Dst: 192.168.75.132
Transmission Control Protocol, Src Port: 21, Dst Port: 40304, Seq: 21, Ack: 12, Len: 34
File Transfer Protocol (FTP)
[Current working directory: ]

No.     Time           Source                Destination           Protocol Length Info
      9 0.028309293    192.168.75.132        121.36.6.255          TCP      54     40304 → 21 [ACK] Seq=12 Ack=55 Win=64186 Len=0

Frame 9: 54 bytes on wire (432 bits), 54 bytes captured (432 bits) on interface 0
Ethernet II, Src: Vmware_61:6e:0f (00:0c:29:61:6e:0f), Dst: Vmware_e1:04:02 (00:50:56:e1:04:02)
Internet Protocol Version 4, Src: 192.168.75.132, Dst: 121.36.6.255
Transmission Control Protocol, Src Port: 40304, Dst Port: 21, Seq: 12, Ack: 55, Len: 0

No.     Time           Source                Destination           Protocol Length Info
     10 0.028577325    192.168.75.132        121.36.6.255          FTP      65     Request: PASS test

Frame 10: 65 bytes on wire (520 bits), 65 bytes captured (520 bits) on interface 0
Ethernet II, Src: Vmware_61:6e:0f (00:0c:29:61:6e:0f), Dst: Vmware_e1:04:02 (00:50:56:e1:04:02)
Internet Protocol Version 4, Src: 192.168.75.132, Dst: 121.36.6.255
Transmission Control Protocol, Src Port: 40304, Dst Port: 21, Seq: 12, Ack: 55, Len: 11
File Transfer Protocol (FTP)
[Current working directory: ]

No.     Time           Source                Destination           Protocol Length Info
     11 0.029136747    121.36.6.255          192.168.75.132        TCP      60     21 → 40304 [ACK] Seq=55 Ack=23 Win=64240 Len=0

Frame 11: 60 bytes on wire (480 bits), 60 bytes captured (480 bits) on interface 0
Ethernet II, Src: Vmware_e1:04:02 (00:50:56:e1:04:02), Dst: Vmware_61:6e:0f (00:0c:29:61:6e:0f)
Internet Protocol Version 4, Src: 121.36.6.255, Dst: 192.168.75.132
Transmission Control Protocol, Src Port: 21, Dst Port: 40304, Seq: 55, Ack: 23, Len: 0

No.     Time           Source                Destination           Protocol Length Info
     12 0.052864456    121.36.6.255          192.168.75.132        FTP      77     Response: 230 Login successful.

Frame 12: 77 bytes on wire (616 bits), 77 bytes captured (616 bits) on interface 0
Ethernet II, Src: Vmware_e1:04:02 (00:50:56:e1:04:02), Dst: Vmware_61:6e:0f (00:0c:29:61:6e:0f)
Internet Protocol Version 4, Src: 121.36.6.255, Dst: 192.168.75.132
Transmission Control Protocol, Src Port: 21, Dst Port: 40304, Seq: 55, Ack: 23, Len: 23
File Transfer Protocol (FTP)
[Current working directory: ]

No.     Time           Source                Destination           Protocol Length Info
     13 0.052891465    192.168.75.132        121.36.6.255          TCP      54     40304 → 21 [ACK] Seq=23 Ack=78 Win=64163 Len=0

Frame 13: 54 bytes on wire (432 bits), 54 bytes captured (432 bits) on interface 0
Ethernet II, Src: Vmware_61:6e:0f (00:0c:29:61:6e:0f), Dst: Vmware_e1:04:02 (00:50:56:e1:04:02)
Internet Protocol Version 4, Src: 192.168.75.132, Dst: 121.36.6.255
Transmission Control Protocol, Src Port: 40304, Dst Port: 21, Seq: 23, Ack: 78, Len: 0

No.     Time           Source                Destination           Protocol Length Info
     14 0.053199937    192.168.75.132        121.36.6.255          FTP      62     Request: TYPE I

Frame 14: 62 bytes on wire (496 bits), 62 bytes captured (496 bits) on interface 0
Ethernet II, Src: Vmware_61:6e:0f (00:0c:29:61:6e:0f), Dst: Vmware_e1:04:02 (00:50:56:e1:04:02)
Internet Protocol Version 4, Src: 192.168.75.132, Dst: 121.36.6.255
Transmission Control Protocol, Src Port: 40304, Dst Port: 21, Seq: 23, Ack: 78, Len: 8
File Transfer Protocol (FTP)
[Current working directory: ]

No.     Time           Source                Destination           Protocol Length Info
     15 0.053523364    121.36.6.255          192.168.75.132        TCP      60     21 → 40304 [ACK] Seq=78 Ack=31 Win=64240 Len=0

Frame 15: 60 bytes on wire (480 bits), 60 bytes captured (480 bits) on interface 0
Ethernet II, Src: Vmware_e1:04:02 (00:50:56:e1:04:02), Dst: Vmware_61:6e:0f (00:0c:29:61:6e:0f)
Internet Protocol Version 4, Src: 121.36.6.255, Dst: 192.168.75.132
Transmission Control Protocol, Src Port: 21, Dst Port: 40304, Seq: 78, Ack: 31, Len: 0

No.     Time           Source                Destination           Protocol Length Info
     16 0.062200760    121.36.6.255          192.168.75.132        FTP      85     Response: 200 Switching to Binary mode.

Frame 16: 85 bytes on wire (680 bits), 85 bytes captured (680 bits) on interface 0
Ethernet II, Src: Vmware_e1:04:02 (00:50:56:e1:04:02), Dst: Vmware_61:6e:0f (00:0c:29:61:6e:0f)
Internet Protocol Version 4, Src: 121.36.6.255, Dst: 192.168.75.132
Transmission Control Protocol, Src Port: 21, Dst Port: 40304, Seq: 78, Ack: 31, Len: 31
File Transfer Protocol (FTP)
[Current working directory: ]

No.     Time           Source                Destination           Protocol Length Info
     17 0.062541284    192.168.75.132        121.36.6.255          FTP      60     Request: PASV

Frame 17: 60 bytes on wire (480 bits), 60 bytes captured (480 bits) on interface 0
Ethernet II, Src: Vmware_61:6e:0f (00:0c:29:61:6e:0f), Dst: Vmware_e1:04:02 (00:50:56:e1:04:02)
Internet Protocol Version 4, Src: 192.168.75.132, Dst: 121.36.6.255
Transmission Control Protocol, Src Port: 40304, Dst Port: 21, Seq: 31, Ack: 109, Len: 6
File Transfer Protocol (FTP)
[Current working directory: ]

No.     Time           Source                Destination           Protocol Length Info
     18 0.062901105    121.36.6.255          192.168.75.132        TCP      60     21 → 40304 [ACK] Seq=109 Ack=37 Win=64240 Len=0

Frame 18: 60 bytes on wire (480 bits), 60 bytes captured (480 bits) on interface 0
Ethernet II, Src: Vmware_e1:04:02 (00:50:56:e1:04:02), Dst: Vmware_61:6e:0f (00:0c:29:61:6e:0f)
Internet Protocol Version 4, Src: 121.36.6.255, Dst: 192.168.75.132
Transmission Control Protocol, Src Port: 21, Dst Port: 40304, Seq: 109, Ack: 37, Len: 0

No.     Time           Source                Destination           Protocol Length Info
     19 0.073393352    121.36.6.255          192.168.75.132        FTP      104    Response: 227 Entering Passive Mode (121,36,6,255,187,162)

Frame 19: 104 bytes on wire (832 bits), 104 bytes captured (832 bits) on interface 0
Ethernet II, Src: Vmware_e1:04:02 (00:50:56:e1:04:02), Dst: Vmware_61:6e:0f (00:0c:29:61:6e:0f)
Internet Protocol Version 4, Src: 121.36.6.255, Dst: 192.168.75.132
Transmission Control Protocol, Src Port: 21, Dst Port: 40304, Seq: 109, Ack: 37, Len: 50
File Transfer Protocol (FTP)
[Current working directory: ]
[Command: STOR test/file000.out]
[Command frame: 23]

No.     Time           Source                Destination           Protocol Length Info
     20 0.073896208    192.168.75.132        121.36.6.255          TCP      74     55232 → 48034 [SYN] Seq=0 Win=64240 Len=0 MSS=1460 SACK_PERM=1 TSval=3821373764 TSecr=0 WS=128

Frame 20: 74 bytes on wire (592 bits), 74 bytes captured (592 bits) on interface 0
Ethernet II, Src: Vmware_61:6e:0f (00:0c:29:61:6e:0f), Dst: Vmware_e1:04:02 (00:50:56:e1:04:02)
Internet Protocol Version 4, Src: 192.168.75.132, Dst: 121.36.6.255
Transmission Control Protocol, Src Port: 55232, Dst Port: 48034, Seq: 0, Len: 0

No.     Time           Source                Destination           Protocol Length Info
     21 0.083820336    121.36.6.255          192.168.75.132        TCP      60     48034 → 55232 [SYN, ACK] Seq=0 Ack=1 Win=64240 Len=0 MSS=1460

Frame 21: 60 bytes on wire (480 bits), 60 bytes captured (480 bits) on interface 0
Ethernet II, Src: Vmware_e1:04:02 (00:50:56:e1:04:02), Dst: Vmware_61:6e:0f (00:0c:29:61:6e:0f)
Internet Protocol Version 4, Src: 121.36.6.255, Dst: 192.168.75.132
Transmission Control Protocol, Src Port: 48034, Dst Port: 55232, Seq: 0, Ack: 1, Len: 0

No.     Time           Source                Destination           Protocol Length Info
     22 0.083879447    192.168.75.132        121.36.6.255          TCP      54     55232 → 48034 [ACK] Seq=1 Ack=1 Win=64240 Len=0

Frame 22: 54 bytes on wire (432 bits), 54 bytes captured (432 bits) on interface 0
Ethernet II, Src: Vmware_61:6e:0f (00:0c:29:61:6e:0f), Dst: Vmware_e1:04:02 (00:50:56:e1:04:02)
Internet Protocol Version 4, Src: 192.168.75.132, Dst: 121.36.6.255
Transmission Control Protocol, Src Port: 55232, Dst Port: 48034, Seq: 1, Ack: 1, Len: 0

No.     Time           Source                Destination           Protocol Length Info
     23 0.084020303    192.168.75.132        121.36.6.255          FTP      77     Request: STOR test/file000.out

Frame 23: 77 bytes on wire (616 bits), 77 bytes captured (616 bits) on interface 0
Ethernet II, Src: Vmware_61:6e:0f (00:0c:29:61:6e:0f), Dst: Vmware_e1:04:02 (00:50:56:e1:04:02)
Internet Protocol Version 4, Src: 192.168.75.132, Dst: 121.36.6.255
Transmission Control Protocol, Src Port: 40304, Dst Port: 21, Seq: 37, Ack: 159, Len: 23
File Transfer Protocol (FTP)
[Current working directory: ]
[Command response frames: 1]
[Command response bytes: 484]
[Command response first frame: 26]
[Command response last frame: 26]
[Setup frame: 19]

No.     Time           Source                Destination           Protocol Length Info
     24 0.084330064    121.36.6.255          192.168.75.132        TCP      60     21 → 40304 [ACK] Seq=159 Ack=60 Win=64240 Len=0

Frame 24: 60 bytes on wire (480 bits), 60 bytes captured (480 bits) on interface 0
Ethernet II, Src: Vmware_e1:04:02 (00:50:56:e1:04:02), Dst: Vmware_61:6e:0f (00:0c:29:61:6e:0f)
Internet Protocol Version 4, Src: 121.36.6.255, Dst: 192.168.75.132
Transmission Control Protocol, Src Port: 21, Dst Port: 40304, Seq: 159, Ack: 60, Len: 0

No.     Time           Source                Destination           Protocol Length Info
     25 0.093320546    121.36.6.255          192.168.75.132        FTP      76     Response: 150 Ok to send data.

Frame 25: 76 bytes on wire (608 bits), 76 bytes captured (608 bits) on interface 0
Ethernet II, Src: Vmware_e1:04:02 (00:50:56:e1:04:02), Dst: Vmware_61:6e:0f (00:0c:29:61:6e:0f)
Internet Protocol Version 4, Src: 121.36.6.255, Dst: 192.168.75.132
Transmission Control Protocol, Src Port: 21, Dst Port: 40304, Seq: 159, Ack: 60, Len: 22
File Transfer Protocol (FTP)
[Current working directory: ]

No.     Time           Source                Destination           Protocol Length Info
     26 0.093544307    192.168.75.132        121.36.6.255          FTP-DATA 538    FTP Data: 484 bytes (PASV) (STOR test/file000.out)

Frame 26: 538 bytes on wire (4304 bits), 538 bytes captured (4304 bits) on interface 0
Ethernet II, Src: Vmware_61:6e:0f (00:0c:29:61:6e:0f), Dst: Vmware_e1:04:02 (00:50:56:e1:04:02)
Internet Protocol Version 4, Src: 192.168.75.132, Dst: 121.36.6.255
Transmission Control Protocol, Src Port: 55232, Dst Port: 48034, Seq: 1, Ack: 1, Len: 484
FTP Data (484 bytes data)
[Setup frame: 19]
[Setup method: PASV]
[Command: STOR test/file000.out]
Command frame: 23
[Current working directory: ]
Line-based text data (1 lines)

No.     Time           Source                Destination           Protocol Length Info
     27 0.093603828    192.168.75.132        121.36.6.255          TCP      54     55232 → 48034 [FIN, ACK] Seq=485 Ack=1 Win=64240 Len=0

Frame 27: 54 bytes on wire (432 bits), 54 bytes captured (432 bits) on interface 0
Ethernet II, Src: Vmware_61:6e:0f (00:0c:29:61:6e:0f), Dst: Vmware_e1:04:02 (00:50:56:e1:04:02)
Internet Protocol Version 4, Src: 192.168.75.132, Dst: 121.36.6.255
Transmission Control Protocol, Src Port: 55232, Dst Port: 48034, Seq: 485, Ack: 1, Len: 0

No.     Time           Source                Destination           Protocol Length Info
     28 0.094034726    121.36.6.255          192.168.75.132        TCP      60     48034 → 55232 [ACK] Seq=1 Ack=485 Win=64240 Len=0

Frame 28: 60 bytes on wire (480 bits), 60 bytes captured (480 bits) on interface 0
Ethernet II, Src: Vmware_e1:04:02 (00:50:56:e1:04:02), Dst: Vmware_61:6e:0f (00:0c:29:61:6e:0f)
Internet Protocol Version 4, Src: 121.36.6.255, Dst: 192.168.75.132
Transmission Control Protocol, Src Port: 48034, Dst Port: 55232, Seq: 1, Ack: 485, Len: 0

No.     Time           Source                Destination           Protocol Length Info
     29 0.094034822    121.36.6.255          192.168.75.132        TCP      60     48034 → 55232 [ACK] Seq=1 Ack=486 Win=64239 Len=0

Frame 29: 60 bytes on wire (480 bits), 60 bytes captured (480 bits) on interface 0
Ethernet II, Src: Vmware_e1:04:02 (00:50:56:e1:04:02), Dst: Vmware_61:6e:0f (00:0c:29:61:6e:0f)
Internet Protocol Version 4, Src: 121.36.6.255, Dst: 192.168.75.132
Transmission Control Protocol, Src Port: 48034, Dst Port: 55232, Seq: 1, Ack: 486, Len: 0

No.     Time           Source                Destination           Protocol Length Info
     30 0.101714924    121.36.6.255          192.168.75.132        TCP      60     48034 → 55232 [FIN, PSH, ACK] Seq=1 Ack=486 Win=64239 Len=0

Frame 30: 60 bytes on wire (480 bits), 60 bytes captured (480 bits) on interface 0
Ethernet II, Src: Vmware_e1:04:02 (00:50:56:e1:04:02), Dst: Vmware_61:6e:0f (00:0c:29:61:6e:0f)
Internet Protocol Version 4, Src: 121.36.6.255, Dst: 192.168.75.132
Transmission Control Protocol, Src Port: 48034, Dst Port: 55232, Seq: 1, Ack: 486, Len: 0

No.     Time           Source                Destination           Protocol Length Info
     31 0.101745520    192.168.75.132        121.36.6.255          TCP      54     55232 → 48034 [ACK] Seq=486 Ack=2 Win=64240 Len=0

Frame 31: 54 bytes on wire (432 bits), 54 bytes captured (432 bits) on interface 0
Ethernet II, Src: Vmware_61:6e:0f (00:0c:29:61:6e:0f), Dst: Vmware_e1:04:02 (00:50:56:e1:04:02)
Internet Protocol Version 4, Src: 192.168.75.132, Dst: 121.36.6.255
Transmission Control Protocol, Src Port: 55232, Dst Port: 48034, Seq: 486, Ack: 2, Len: 0

No.     Time           Source                Destination           Protocol Length Info
     32 0.109804376    121.36.6.255          192.168.75.132        FTP      78     Response: 226 Transfer complete.

Frame 32: 78 bytes on wire (624 bits), 78 bytes captured (624 bits) on interface 0
Ethernet II, Src: Vmware_e1:04:02 (00:50:56:e1:04:02), Dst: Vmware_61:6e:0f (00:0c:29:61:6e:0f)
Internet Protocol Version 4, Src: 121.36.6.255, Dst: 192.168.75.132
Transmission Control Protocol, Src Port: 21, Dst Port: 40304, Seq: 181, Ack: 60, Len: 24
File Transfer Protocol (FTP)
[Current working directory: ]

No.     Time           Source                Destination           Protocol Length Info
     33 0.110039245    192.168.75.132        121.36.6.255          TCP      54     40304 → 21 [ACK] Seq=60 Ack=205 Win=64036 Len=0

Frame 33: 54 bytes on wire (432 bits), 54 bytes captured (432 bits) on interface 0
Ethernet II, Src: Vmware_61:6e:0f (00:0c:29:61:6e:0f), Dst: Vmware_e1:04:02 (00:50:56:e1:04:02)
Internet Protocol Version 4, Src: 192.168.75.132, Dst: 121.36.6.255
Transmission Control Protocol, Src Port: 40304, Dst Port: 21, Seq: 60, Ack: 205, Len: 0

No.     Time           Source                Destination           Protocol Length Info
     34 0.110138485    192.168.75.132        121.36.6.255          FTP      62     Request: TYPE I

Frame 34: 62 bytes on wire (496 bits), 62 bytes captured (496 bits) on interface 0
Ethernet II, Src: Vmware_61:6e:0f (00:0c:29:61:6e:0f), Dst: Vmware_e1:04:02 (00:50:56:e1:04:02)
Internet Protocol Version 4, Src: 192.168.75.132, Dst: 121.36.6.255
Transmission Control Protocol, Src Port: 40304, Dst Port: 21, Seq: 60, Ack: 205, Len: 8
File Transfer Protocol (FTP)
[Current working directory: ]

No.     Time           Source                Destination           Protocol Length Info
     35 0.110379861    121.36.6.255          192.168.75.132        TCP      60     21 → 40304 [ACK] Seq=205 Ack=68 Win=64240 Len=0

Frame 35: 60 bytes on wire (480 bits), 60 bytes captured (480 bits) on interface 0
Ethernet II, Src: Vmware_e1:04:02 (00:50:56:e1:04:02), Dst: Vmware_61:6e:0f (00:0c:29:61:6e:0f)
Internet Protocol Version 4, Src: 121.36.6.255, Dst: 192.168.75.132
Transmission Control Protocol, Src Port: 21, Dst Port: 40304, Seq: 205, Ack: 68, Len: 0

No.     Time           Source                Destination           Protocol Length Info
     36 0.118850693    121.36.6.255          192.168.75.132        FTP      85     Response: 200 Switching to Binary mode.

Frame 36: 85 bytes on wire (680 bits), 85 bytes captured (680 bits) on interface 0
Ethernet II, Src: Vmware_e1:04:02 (00:50:56:e1:04:02), Dst: Vmware_61:6e:0f (00:0c:29:61:6e:0f)
Internet Protocol Version 4, Src: 121.36.6.255, Dst: 192.168.75.132
Transmission Control Protocol, Src Port: 21, Dst Port: 40304, Seq: 205, Ack: 68, Len: 31
File Transfer Protocol (FTP)
[Current working directory: ]

No.     Time           Source                Destination           Protocol Length Info
     37 0.119034515    192.168.75.132        121.36.6.255          FTP      60     Request: PASV

Frame 37: 60 bytes on wire (480 bits), 60 bytes captured (480 bits) on interface 0
Ethernet II, Src: Vmware_61:6e:0f (00:0c:29:61:6e:0f), Dst: Vmware_e1:04:02 (00:50:56:e1:04:02)
Internet Protocol Version 4, Src: 192.168.75.132, Dst: 121.36.6.255
Transmission Control Protocol, Src Port: 40304, Dst Port: 21, Seq: 68, Ack: 236, Len: 6
File Transfer Protocol (FTP)
[Current working directory: ]

No.     Time           Source                Destination           Protocol Length Info
     38 0.119443729    121.36.6.255          192.168.75.132        TCP      60     21 → 40304 [ACK] Seq=236 Ack=74 Win=64240 Len=0

Frame 38: 60 bytes on wire (480 bits), 60 bytes captured (480 bits) on interface 0
Ethernet II, Src: Vmware_e1:04:02 (00:50:56:e1:04:02), Dst: Vmware_61:6e:0f (00:0c:29:61:6e:0f)
Internet Protocol Version 4, Src: 121.36.6.255, Dst: 192.168.75.132
Transmission Control Protocol, Src Port: 21, Dst Port: 40304, Seq: 236, Ack: 74, Len: 0

No.     Time           Source                Destination           Protocol Length Info
     39 0.128121070    121.36.6.255          192.168.75.132        FTP      102    Response: 227 Entering Passive Mode (121,36,6,255,9,232)

Frame 39: 102 bytes on wire (816 bits), 102 bytes captured (816 bits) on interface 0
Ethernet II, Src: Vmware_e1:04:02 (00:50:56:e1:04:02), Dst: Vmware_61:6e:0f (00:0c:29:61:6e:0f)
Internet Protocol Version 4, Src: 121.36.6.255, Dst: 192.168.75.132
Transmission Control Protocol, Src Port: 21, Dst Port: 40304, Seq: 236, Ack: 74, Len: 48
File Transfer Protocol (FTP)
[Current working directory: ]
[Command: STOR test/file001.out]
[Command frame: 43]

No.     Time           Source                Destination           Protocol Length Info
     40 0.128314210    192.168.75.132        121.36.6.255          TCP      74     48904 → 2536 [SYN] Seq=0 Win=64240 Len=0 MSS=1460 SACK_PERM=1 TSval=3821373818 TSecr=0 WS=128

Frame 40: 74 bytes on wire (592 bits), 74 bytes captured (592 bits) on interface 0
Ethernet II, Src: Vmware_61:6e:0f (00:0c:29:61:6e:0f), Dst: Vmware_e1:04:02 (00:50:56:e1:04:02)
Internet Protocol Version 4, Src: 192.168.75.132, Dst: 121.36.6.255
Transmission Control Protocol, Src Port: 48904, Dst Port: 2536, Seq: 0, Len: 0

No.     Time           Source                Destination           Protocol Length Info
     41 0.135389993    121.36.6.255          192.168.75.132        TCP      60     2536 → 48904 [SYN, ACK] Seq=0 Ack=1 Win=64240 Len=0 MSS=1460

Frame 41: 60 bytes on wire (480 bits), 60 bytes captured (480 bits) on interface 0
Ethernet II, Src: Vmware_e1:04:02 (00:50:56:e1:04:02), Dst: Vmware_61:6e:0f (00:0c:29:61:6e:0f)
Internet Protocol Version 4, Src: 121.36.6.255, Dst: 192.168.75.132
Transmission Control Protocol, Src Port: 2536, Dst Port: 48904, Seq: 0, Ack: 1, Len: 0

No.     Time           Source                Destination           Protocol Length Info
     42 0.135457123    192.168.75.132        121.36.6.255          TCP      54     48904 → 2536 [ACK] Seq=1 Ack=1 Win=64240 Len=0

Frame 42: 54 bytes on wire (432 bits), 54 bytes captured (432 bits) on interface 0
Ethernet II, Src: Vmware_61:6e:0f (00:0c:29:61:6e:0f), Dst: Vmware_e1:04:02 (00:50:56:e1:04:02)
Internet Protocol Version 4, Src: 192.168.75.132, Dst: 121.36.6.255
Transmission Control Protocol, Src Port: 48904, Dst Port: 2536, Seq: 1, Ack: 1, Len: 0

No.     Time           Source                Destination           Protocol Length Info
     43 0.135602347    192.168.75.132        121.36.6.255          FTP      77     Request: STOR test/file001.out

Frame 43: 77 bytes on wire (616 bits), 77 bytes captured (616 bits) on interface 0
Ethernet II, Src: Vmware_61:6e:0f (00:0c:29:61:6e:0f), Dst: Vmware_e1:04:02 (00:50:56:e1:04:02)
Internet Protocol Version 4, Src: 192.168.75.132, Dst: 121.36.6.255
Transmission Control Protocol, Src Port: 40304, Dst Port: 21, Seq: 74, Ack: 284, Len: 23
File Transfer Protocol (FTP)
[Current working directory: ]
[Command response frames: 2]
[Command response bytes: 1050]
[Command response first frame: 46]
[Command response last frame: 47]
[Response duration: 0ms]
[Response bitrate: 0Kbps]
[Setup frame: 39]

No.     Time           Source                Destination           Protocol Length Info
     44 0.135998933    121.36.6.255          192.168.75.132        TCP      60     21 → 40304 [ACK] Seq=284 Ack=97 Win=64240 Len=0

Frame 44: 60 bytes on wire (480 bits), 60 bytes captured (480 bits) on interface 0
Ethernet II, Src: Vmware_e1:04:02 (00:50:56:e1:04:02), Dst: Vmware_61:6e:0f (00:0c:29:61:6e:0f)
Internet Protocol Version 4, Src: 121.36.6.255, Dst: 192.168.75.132
Transmission Control Protocol, Src Port: 21, Dst Port: 40304, Seq: 284, Ack: 97, Len: 0

No.     Time           Source                Destination           Protocol Length Info
     45 0.144708113    121.36.6.255          192.168.75.132        FTP      76     Response: 150 Ok to send data.

Frame 45: 76 bytes on wire (608 bits), 76 bytes captured (608 bits) on interface 0
Ethernet II, Src: Vmware_e1:04:02 (00:50:56:e1:04:02), Dst: Vmware_61:6e:0f (00:0c:29:61:6e:0f)
Internet Protocol Version 4, Src: 121.36.6.255, Dst: 192.168.75.132
Transmission Control Protocol, Src Port: 21, Dst Port: 40304, Seq: 284, Ack: 97, Len: 22
File Transfer Protocol (FTP)
[Current working directory: ]

No.     Time           Source                Destination           Protocol Length Info
     46 0.144878939    192.168.75.132        121.36.6.255          FTP-DATA 566    FTP Data: 512 bytes (PASV) (STOR test/file001.out)

Frame 46: 566 bytes on wire (4528 bits), 566 bytes captured (4528 bits) on interface 0
Ethernet II, Src: Vmware_61:6e:0f (00:0c:29:61:6e:0f), Dst: Vmware_e1:04:02 (00:50:56:e1:04:02)
Internet Protocol Version 4, Src: 192.168.75.132, Dst: 121.36.6.255
Transmission Control Protocol, Src Port: 48904, Dst Port: 2536, Seq: 1, Ack: 1, Len: 512
FTP Data (512 bytes data)
[Setup frame: 39]
[Setup method: PASV]
[Command: STOR test/file001.out]
Command frame: 43
[Current working directory: ]
Line-based text data (1 lines)

No.     Time           Source                Destination           Protocol Length Info
     47 0.144962336    192.168.75.132        121.36.6.255          FTP-DATA 592    FTP Data: 538 bytes (PASV) (STOR test/file001.out)

Frame 47: 592 bytes on wire (4736 bits), 592 bytes captured (4736 bits) on interface 0
Ethernet II, Src: Vmware_61:6e:0f (00:0c:29:61:6e:0f), Dst: Vmware_e1:04:02 (00:50:56:e1:04:02)
Internet Protocol Version 4, Src: 192.168.75.132, Dst: 121.36.6.255
Transmission Control Protocol, Src Port: 48904, Dst Port: 2536, Seq: 513, Ack: 1, Len: 538
FTP Data (538 bytes data)
[Setup frame: 39]
[Setup method: PASV]
[Command: STOR test/file001.out]
Command frame: 43
[Current working directory: ]
Line-based text data (1 lines)

No.     Time           Source                Destination           Protocol Length Info
     48 0.145258154    121.36.6.255          192.168.75.132        TCP      60     2536 → 48904 [ACK] Seq=1 Ack=513 Win=64240 Len=0

Frame 48: 60 bytes on wire (480 bits), 60 bytes captured (480 bits) on interface 0
Ethernet II, Src: Vmware_e1:04:02 (00:50:56:e1:04:02), Dst: Vmware_61:6e:0f (00:0c:29:61:6e:0f)
Internet Protocol Version 4, Src: 121.36.6.255, Dst: 192.168.75.132
Transmission Control Protocol, Src Port: 2536, Dst Port: 48904, Seq: 1, Ack: 513, Len: 0

No.     Time           Source                Destination           Protocol Length Info
     49 0.145258257    121.36.6.255          192.168.75.132        TCP      60     2536 → 48904 [ACK] Seq=1 Ack=1052 Win=64239 Len=0

Frame 49: 60 bytes on wire (480 bits), 60 bytes captured (480 bits) on interface 0
Ethernet II, Src: Vmware_e1:04:02 (00:50:56:e1:04:02), Dst: Vmware_61:6e:0f (00:0c:29:61:6e:0f)
Internet Protocol Version 4, Src: 121.36.6.255, Dst: 192.168.75.132
Transmission Control Protocol, Src Port: 2536, Dst Port: 48904, Seq: 1, Ack: 1052, Len: 0

No.     Time           Source                Destination           Protocol Length Info
     50 0.151941735    121.36.6.255          192.168.75.132        TCP      60     2536 → 48904 [FIN, PSH, ACK] Seq=1 Ack=1052 Win=64239 Len=0

Frame 50: 60 bytes on wire (480 bits), 60 bytes captured (480 bits) on interface 0
Ethernet II, Src: Vmware_e1:04:02 (00:50:56:e1:04:02), Dst: Vmware_61:6e:0f (00:0c:29:61:6e:0f)
Internet Protocol Version 4, Src: 121.36.6.255, Dst: 192.168.75.132
Transmission Control Protocol, Src Port: 2536, Dst Port: 48904, Seq: 1, Ack: 1052, Len: 0

No.     Time           Source                Destination           Protocol Length Info
     51 0.151971298    192.168.75.132        121.36.6.255          TCP      54     48904 → 2536 [ACK] Seq=1052 Ack=2 Win=64240 Len=0

Frame 51: 54 bytes on wire (432 bits), 54 bytes captured (432 bits) on interface 0
Ethernet II, Src: Vmware_61:6e:0f (00:0c:29:61:6e:0f), Dst: Vmware_e1:04:02 (00:50:56:e1:04:02)
Internet Protocol Version 4, Src: 192.168.75.132, Dst: 121.36.6.255
Transmission Control Protocol, Src Port: 48904, Dst Port: 2536, Seq: 1052, Ack: 2, Len: 0

No.     Time           Source                Destination           Protocol Length Info
     52 0.159416024    121.36.6.255          192.168.75.132        FTP      78     Response: 226 Transfer complete.

Frame 52: 78 bytes on wire (624 bits), 78 bytes captured (624 bits) on interface 0
Ethernet II, Src: Vmware_e1:04:02 (00:50:56:e1:04:02), Dst: Vmware_61:6e:0f (00:0c:29:61:6e:0f)
Internet Protocol Version 4, Src: 121.36.6.255, Dst: 192.168.75.132
Transmission Control Protocol, Src Port: 21, Dst Port: 40304, Seq: 306, Ack: 97, Len: 24
File Transfer Protocol (FTP)
[Current working directory: ]

No.     Time           Source                Destination           Protocol Length Info
     53 0.159621736    192.168.75.132        121.36.6.255          TCP      54     40304 → 21 [ACK] Seq=97 Ack=330 Win=64036 Len=0

Frame 53: 54 bytes on wire (432 bits), 54 bytes captured (432 bits) on interface 0
Ethernet II, Src: Vmware_61:6e:0f (00:0c:29:61:6e:0f), Dst: Vmware_e1:04:02 (00:50:56:e1:04:02)
Internet Protocol Version 4, Src: 192.168.75.132, Dst: 121.36.6.255
Transmission Control Protocol, Src Port: 40304, Dst Port: 21, Seq: 97, Ack: 330, Len: 0

No.     Time           Source                Destination           Protocol Length Info
     54 0.159770058    192.168.75.132        121.36.6.255          FTP      62     Request: TYPE I

Frame 54: 62 bytes on wire (496 bits), 62 bytes captured (496 bits) on interface 0
Ethernet II, Src: Vmware_61:6e:0f (00:0c:29:61:6e:0f), Dst: Vmware_e1:04:02 (00:50:56:e1:04:02)
Internet Protocol Version 4, Src: 192.168.75.132, Dst: 121.36.6.255
Transmission Control Protocol, Src Port: 40304, Dst Port: 21, Seq: 97, Ack: 330, Len: 8
File Transfer Protocol (FTP)
[Current working directory: ]

No.     Time           Source                Destination           Protocol Length Info
     55 0.160137850    121.36.6.255          192.168.75.132        TCP      60     21 → 40304 [ACK] Seq=330 Ack=105 Win=64240 Len=0

Frame 55: 60 bytes on wire (480 bits), 60 bytes captured (480 bits) on interface 0
Ethernet II, Src: Vmware_e1:04:02 (00:50:56:e1:04:02), Dst: Vmware_61:6e:0f (00:0c:29:61:6e:0f)
Internet Protocol Version 4, Src: 121.36.6.255, Dst: 192.168.75.132
Transmission Control Protocol, Src Port: 21, Dst Port: 40304, Seq: 330, Ack: 105, Len: 0

No.     Time           Source                Destination           Protocol Length Info
     56 0.168293744    121.36.6.255          192.168.75.132        FTP      85     Response: 200 Switching to Binary mode.

Frame 56: 85 bytes on wire (680 bits), 85 bytes captured (680 bits) on interface 0
Ethernet II, Src: Vmware_e1:04:02 (00:50:56:e1:04:02), Dst: Vmware_61:6e:0f (00:0c:29:61:6e:0f)
Internet Protocol Version 4, Src: 121.36.6.255, Dst: 192.168.75.132
Transmission Control Protocol, Src Port: 21, Dst Port: 40304, Seq: 330, Ack: 105, Len: 31
File Transfer Protocol (FTP)
[Current working directory: ]

No.     Time           Source                Destination           Protocol Length Info
     57 0.168454546    192.168.75.132        121.36.6.255          FTP      60     Request: PASV

Frame 57: 60 bytes on wire (480 bits), 60 bytes captured (480 bits) on interface 0
Ethernet II, Src: Vmware_61:6e:0f (00:0c:29:61:6e:0f), Dst: Vmware_e1:04:02 (00:50:56:e1:04:02)
Internet Protocol Version 4, Src: 192.168.75.132, Dst: 121.36.6.255
Transmission Control Protocol, Src Port: 40304, Dst Port: 21, Seq: 105, Ack: 361, Len: 6
File Transfer Protocol (FTP)
[Current working directory: ]

No.     Time           Source                Destination           Protocol Length Info
     58 0.168688652    121.36.6.255          192.168.75.132        TCP      60     21 → 40304 [ACK] Seq=361 Ack=111 Win=64240 Len=0

Frame 58: 60 bytes on wire (480 bits), 60 bytes captured (480 bits) on interface 0
Ethernet II, Src: Vmware_e1:04:02 (00:50:56:e1:04:02), Dst: Vmware_61:6e:0f (00:0c:29:61:6e:0f)
Internet Protocol Version 4, Src: 121.36.6.255, Dst: 192.168.75.132
Transmission Control Protocol, Src Port: 21, Dst Port: 40304, Seq: 361, Ack: 111, Len: 0

No.     Time           Source                Destination           Protocol Length Info
     59 0.177275311    121.36.6.255          192.168.75.132        FTP      102    Response: 227 Entering Passive Mode (121,36,6,255,38,79)

Frame 59: 102 bytes on wire (816 bits), 102 bytes captured (816 bits) on interface 0
Ethernet II, Src: Vmware_e1:04:02 (00:50:56:e1:04:02), Dst: Vmware_61:6e:0f (00:0c:29:61:6e:0f)
Internet Protocol Version 4, Src: 121.36.6.255, Dst: 192.168.75.132
Transmission Control Protocol, Src Port: 21, Dst Port: 40304, Seq: 361, Ack: 111, Len: 48
File Transfer Protocol (FTP)
[Current working directory: ]
[Command: STOR test/file002.out]
[Command frame: 63]

No.     Time           Source                Destination           Protocol Length Info
     60 0.177601095    192.168.75.132        121.36.6.255          TCP      74     52862 → 9807 [SYN] Seq=0 Win=64240 Len=0 MSS=1460 SACK_PERM=1 TSval=3821373868 TSecr=0 WS=128

Frame 60: 74 bytes on wire (592 bits), 74 bytes captured (592 bits) on interface 0
Ethernet II, Src: Vmware_61:6e:0f (00:0c:29:61:6e:0f), Dst: Vmware_e1:04:02 (00:50:56:e1:04:02)
Internet Protocol Version 4, Src: 192.168.75.132, Dst: 121.36.6.255
Transmission Control Protocol, Src Port: 52862, Dst Port: 9807, Seq: 0, Len: 0

No.     Time           Source                Destination           Protocol Length Info
     61 0.184890711    121.36.6.255          192.168.75.132        TCP      60     9807 → 52862 [SYN, ACK] Seq=0 Ack=1 Win=64240 Len=0 MSS=1460

Frame 61: 60 bytes on wire (480 bits), 60 bytes captured (480 bits) on interface 0
Ethernet II, Src: Vmware_e1:04:02 (00:50:56:e1:04:02), Dst: Vmware_61:6e:0f (00:0c:29:61:6e:0f)
Internet Protocol Version 4, Src: 121.36.6.255, Dst: 192.168.75.132
Transmission Control Protocol, Src Port: 9807, Dst Port: 52862, Seq: 0, Ack: 1, Len: 0

No.     Time           Source                Destination           Protocol Length Info
     62 0.184947948    192.168.75.132        121.36.6.255          TCP      54     52862 → 9807 [ACK] Seq=1 Ack=1 Win=64240 Len=0

Frame 62: 54 bytes on wire (432 bits), 54 bytes captured (432 bits) on interface 0
Ethernet II, Src: Vmware_61:6e:0f (00:0c:29:61:6e:0f), Dst: Vmware_e1:04:02 (00:50:56:e1:04:02)
Internet Protocol Version 4, Src: 192.168.75.132, Dst: 121.36.6.255
Transmission Control Protocol, Src Port: 52862, Dst Port: 9807, Seq: 1, Ack: 1, Len: 0

No.     Time           Source                Destination           Protocol Length Info
     63 0.185064234    192.168.75.132        121.36.6.255          FTP      77     Request: STOR test/file002.out

Frame 63: 77 bytes on wire (616 bits), 77 bytes captured (616 bits) on interface 0
Ethernet II, Src: Vmware_61:6e:0f (00:0c:29:61:6e:0f), Dst: Vmware_e1:04:02 (00:50:56:e1:04:02)
Internet Protocol Version 4, Src: 192.168.75.132, Dst: 121.36.6.255
Transmission Control Protocol, Src Port: 40304, Dst Port: 21, Seq: 111, Ack: 409, Len: 23
File Transfer Protocol (FTP)
[Current working directory: ]
[Command response frames: 1]
[Command response bytes: 482]
[Command response first frame: 66]
[Command response last frame: 66]
[Setup frame: 59]

No.     Time           Source                Destination           Protocol Length Info
     64 0.185373913    121.36.6.255          192.168.75.132        TCP      60     21 → 40304 [ACK] Seq=409 Ack=134 Win=64240 Len=0

Frame 64: 60 bytes on wire (480 bits), 60 bytes captured (480 bits) on interface 0
Ethernet II, Src: Vmware_e1:04:02 (00:50:56:e1:04:02), Dst: Vmware_61:6e:0f (00:0c:29:61:6e:0f)
Internet Protocol Version 4, Src: 121.36.6.255, Dst: 192.168.75.132
Transmission Control Protocol, Src Port: 21, Dst Port: 40304, Seq: 409, Ack: 134, Len: 0

No.     Time           Source                Destination           Protocol Length Info
     65 0.193712066    121.36.6.255          192.168.75.132        FTP      76     Response: 150 Ok to send data.

Frame 65: 76 bytes on wire (608 bits), 76 bytes captured (608 bits) on interface 0
Ethernet II, Src: Vmware_e1:04:02 (00:50:56:e1:04:02), Dst: Vmware_61:6e:0f (00:0c:29:61:6e:0f)
Internet Protocol Version 4, Src: 121.36.6.255, Dst: 192.168.75.132
Transmission Control Protocol, Src Port: 21, Dst Port: 40304, Seq: 409, Ack: 134, Len: 22
File Transfer Protocol (FTP)
[Current working directory: ]

No.     Time           Source                Destination           Protocol Length Info
     66 0.194221710    192.168.75.132        121.36.6.255          FTP-DATA 536    FTP Data: 482 bytes (PASV) (STOR test/file002.out)

Frame 66: 536 bytes on wire (4288 bits), 536 bytes captured (4288 bits) on interface 0
Ethernet II, Src: Vmware_61:6e:0f (00:0c:29:61:6e:0f), Dst: Vmware_e1:04:02 (00:50:56:e1:04:02)
Internet Protocol Version 4, Src: 192.168.75.132, Dst: 121.36.6.255
Transmission Control Protocol, Src Port: 52862, Dst Port: 9807, Seq: 1, Ack: 1, Len: 482
FTP Data (482 bytes data)
[Setup frame: 59]
[Setup method: PASV]
[Command: STOR test/file002.out]
Command frame: 63
[Current working directory: ]
Line-based text data (1 lines)

No.     Time           Source                Destination           Protocol Length Info
     67 0.194287988    192.168.75.132        121.36.6.255          TCP      54     52862 → 9807 [FIN, ACK] Seq=483 Ack=1 Win=64240 Len=0

Frame 67: 54 bytes on wire (432 bits), 54 bytes captured (432 bits) on interface 0
Ethernet II, Src: Vmware_61:6e:0f (00:0c:29:61:6e:0f), Dst: Vmware_e1:04:02 (00:50:56:e1:04:02)
